{
  "actions": {},
  "fragmentId": "scaffold",
  "groups": {},
  "handlers": {
    "HelloRuntimeTaskHandler": {
      "module": "./handlers/HelloRuntimeTaskHandler.js"
    }
  },
  "includes": [],
  "leaves": {},
  "schemaVersion": 1,
  "tasks": {
    "wt:check:hello": {
      "catalog": {
        "executionScope": "lane-runtime",
        "inputSchema": "watchtower://runtime/schemas/scaffold-message-input/v1",
        "leafIds": [],
        "mutationClass": "read-only",
        "requiresInvocationEnvelope": false,
        "resultSchema": "watchtower://runtime/schemas/scaffold-message-result/v1"
      },
      "doc": {
        "summary": "Example runtime task retained until baseline handlers replace the scaffold.",
        "usage": "Internal Watchtower build task."
      },
      "handle": {
        "args": [
          "Hello from watchtower runtime NVB."
        ],
        "handler": "HelloRuntimeTaskHandler",
        "type": "auto"
      },
      "runnerOpts": {}
    }
  }
}
